{
  "$schema": "https://json-schema.org/draft/2020-12/schema",
  "title": "Background",
  "description": "Параллакс-фон из зацикленных по горизонтали слоёв. Слои — снизу вверх (от дальнего к ближнему).",
  "type": "object",
  "required": ["id", "sky_color", "scale"],
  "properties": {
    "id": { "type": "string" },
    "description": { "type": "string" },
    "sky_color": { "type": "string", "pattern": "^#[0-9a-fA-F]{6}$", "description": "Цвет заливки за слоями (виден, если слои не покрывают экран по высоте)" },
    "scale": { "type": "integer", "minimum": 1, "description": "Во сколько раз увеличить пиксели слоёв (целое — пиксель-арт остаётся чётким)" },
    "ground_offset": { "type": "number", "minimum": 0, "description": "На сколько px от низа уровня приподняты слои: нижний край фона стоит над землёй (например, на высоте первого ряда блоков)" },
    "ground_color": { "type": "string", "pattern": "^#[0-9a-fA-F]{6}$", "description": "Цвет заливки под нижним краем фона вниз до края экрана (чтобы на верхних платформах под фоном не было пустоты); обычно цвет нижнего ряда ближнего слоя" },
    "shader": {
      "type": "object",
      "description": "Фон-шейдер вместо слоёв: закрученная краска в трёх цветах (как фон Balatro)",
      "required": ["type", "colors"],
      "properties": {
        "type": { "type": "string", "enum": ["swirl"] },
        "colors": { "type": "array", "minItems": 3, "maxItems": 3, "items": { "type": "string", "pattern": "^#[0-9a-fA-F]{6}$" }, "description": "Основной, акцент, тёмный" },
        "speed": { "type": "number", "minimum": 0 },
        "spin": { "type": "number", "minimum": 0 },
        "contrast": { "type": "number", "minimum": 0.5 },
        "pixel": { "type": "number", "minimum": 0, "description": "Размер «пикселя» шейдера в px арта (0 — гладко, без пикселизации)" },
        "zoom": { "type": "number", "minimum": 4, "description": "Частота пятен (по умолчанию 30): меньше — крупнее и спокойнее" }
      }
    },
    "layers": {
      "type": "array",
      "minItems": 0,
      "items": {
        "type": "object",
        "required": ["name", "sprite_id", "parallax_x"],
        "properties": {
          "name": { "type": "string" },
          "sprite_id": { "type": "string", "description": "Id спрайта-слоя из data/sprites/sprites.json (картинка тайлится по горизонтали)" },
          "parallax_x": { "type": "number", "minimum": 0, "description": "Доля сдвига камеры по X (0 — неподвижный, 1 — как мир)" },
          "crop_left": { "type": "integer", "minimum": 0, "description": "Отрезать столько левых столбцов картинки (если крайний столбец «битый» и даёт шов при тайлинге)" },
          "mirror": { "type": "boolean", "description": "Тайлить зеркально (оригинал + отражение): края тайлов всегда совпадают, шва нет" }
        }
      }
    }
  }
}
