{
  "$schema": "../schemas/background.schema.json",
  "id": "bg_loc6",
  "description": "Фон финальной локации: шейдер «закрученная краска» (как фон Balatro) в фиолетовых тонах палитры краба (рампа virus): основной, акцент, тёмный. Слоёв-картинок нет. Спокойный: медленное течение, крупные пятна (zoom), без пикселизации (pixel 0). Параметры: speed, spin, contrast, pixel, zoom.",
  "sky_color": "#110320",
  "scale": 2,
  "layers": [],
  "shader": {
    "type": "swirl",
    "colors": [
      "#620792",
      "#d00df8",
      "#110320"
    ],
    "speed": 0.3,
    "spin": 1.0,
    "contrast": 2.6,
    "pixel": 0,
    "zoom": 14
  }
}
